{"$id":"https://six-birds.local/fvii-sci-01/scenario.schema.json","$schema":"https://json-schema.org/draft/2020-12/schema","additionalProperties":false,"properties":{"assertions":{"additionalProperties":false,"minProperties":1,"properties":{"bridge_valid":{"type":"boolean"},"certified_noninteraction":{"type":"boolean"},"contact":{"type":"boolean"},"directionality":{"type":"boolean"},"endogenous":{"type":"boolean"},"first_extension":{"type":"boolean"},"holonomy":{"type":"boolean"},"new_residual":{"type":"boolean"},"occurred":{"type":"boolean"},"prospective_credit":{"type":"boolean"},"reachable":{"type":"boolean"},"strict_join":{"type":"boolean"}},"type":"object"},"candidate_ids":{"items":{"pattern":"^VII-C[0-9]{3}$","type":"string"},"type":"array","uniqueItems":true},"expected_status":{"enum":["BOOTSTRAP_BLOCKED","BUDGET_OBSTRUCTION","CERTIFIED_NONINTERACTION","COMMON_REFINEMENT_NONSTRICT","CONTACT_WITHOUT_JOIN","DRIVEN_ARROW","FAKE_JOIN_RELABELING","FAKE_JOIN_SCHEDULING","HOLONOMY_ZERO_ARROW","INDEPENDENCE_GATE_FAILED","LAWFUL_FIRST_EXTENSION","NO_EVIDENCED_CONTACT","OCCURRENT_EVENT","ORDER_RESIDUE","PROSPECTIVE_ADMISSION","REACHABLE_NONOCCURRENT","REFINEMENT_DESTROYS_JOIN","RETENTION_OBSTRUCTION","RETROSPECTIVE_SELF_CERTIFICATION_REJECTED","SOUND_UNREACHABLE","SOURCE_OBSTRUCTION","STRICT_JOIN","UNLICENSED_TOTALITY_TRANSFER","UNPRICED_OBSERVER"],"type":"string"},"falsifier":{"minLength":1,"type":"string"},"fixture_id":{"pattern":"^TTW-S[0-9]{2}$","type":"string"},"fixture_kind":{"const":"scenario"},"flags":{"additionalProperties":false,"properties":{"anti_product":{"type":"boolean"},"budget_ok":{"type":"boolean"},"closed_family":{"type":"boolean"},"common_refinement":{"type":"boolean"},"compatible":{"type":"boolean"},"composite":{"type":"boolean"},"contact":{"type":"boolean"},"detector_power":{"type":"boolean"},"drive":{"type":"boolean"},"fired":{"type":"boolean"},"generator_reachable":{"type":"boolean"},"holonomy":{"type":"boolean"},"join_destroyed":{"type":"boolean"},"neutral_seed":{"type":"boolean"},"new_residual":{"type":"boolean"},"observer_priced":{"type":"boolean"},"observer_used":{"type":"boolean"},"order_residue":{"type":"boolean"},"parent_refined":{"type":"boolean"},"partial_domain":{"type":"boolean"},"prospective":{"type":"boolean"},"reachable":{"type":"boolean"},"relabel_only":{"type":"boolean"},"resemblance_only":{"type":"boolean"},"retention":{"type":"boolean"},"retrospective":{"type":"boolean"},"same_source":{"type":"boolean"},"scheduling_only":{"type":"boolean"},"seed":{"type":"boolean"},"sound":{"type":"boolean"},"source_independent":{"type":"boolean"},"total_lens_only":{"type":"boolean"}},"required":["anti_product","budget_ok","closed_family","common_refinement","compatible","composite","contact","detector_power","drive","fired","generator_reachable","holonomy","join_destroyed","neutral_seed","new_residual","observer_priced","observer_used","order_residue","parent_refined","partial_domain","prospective","reachable","relabel_only","resemblance_only","retention","retrospective","same_source","scheduling_only","seed","sound","source_independent","total_lens_only"],"type":"object"},"name":{"minLength":1,"type":"string"},"schema_version":{"const":"FVII-SCI-01.3"},"source_trace":{"additionalProperties":false,"properties":{"migration":{"minLength":1,"type":"string"},"source_id":{"minLength":1,"type":"string"},"source_path":{"minLength":1,"type":"string"}},"required":["source_path","source_id","migration"],"type":"object"},"structural_record":{"additionalProperties":false,"properties":{"admission_transition":{"additionalProperties":false,"properties":{"cost":{"minimum":0,"type":"integer"},"effect_description":{"minLength":1,"type":"string"},"executable":{"type":"boolean"},"fired":{"type":"boolean"},"guard_description":{"minLength":1,"type":"string"},"guard_satisfied":{"type":"boolean"},"source":{"additionalProperties":false,"properties":{"admissible":{"type":"boolean"},"exposed":{"type":"boolean"},"expressible":{"type":"boolean"},"interface_id":{"minimum":0,"type":"integer"},"occurrent":{"type":"boolean"},"present":{"type":"boolean"},"reachable":{"type":"boolean"},"recoverable":{"type":"boolean"},"scope_id":{"minLength":1,"type":"string"},"theory_id":{"minimum":0,"type":"integer"},"timestamp":{"minimum":0,"type":"integer"}},"required":["theory_id","interface_id","scope_id","timestamp","expressible","present","exposed","recoverable","admissible","reachable","occurrent"],"type":"object"},"source_id":{"minLength":1,"type":"string"},"target":{"additionalProperties":false,"properties":{"admissible":{"type":"boolean"},"exposed":{"type":"boolean"},"expressible":{"type":"boolean"},"interface_id":{"minimum":0,"type":"integer"},"occurrent":{"type":"boolean"},"present":{"type":"boolean"},"reachable":{"type":"boolean"},"recoverable":{"type":"boolean"},"scope_id":{"minLength":1,"type":"string"},"theory_id":{"minimum":0,"type":"integer"},"timestamp":{"minimum":0,"type":"integer"}},"required":["theory_id","interface_id","scope_id","timestamp","expressible","present","exposed","recoverable","admissible","reachable","occurrent"],"type":"object"},"transition_id":{"minLength":1,"type":"string"}},"required":["transition_id","source","target","source_id","guard_description","guard_satisfied","cost","effect_description","executable","fired"],"type":"object"},"audit_record":{"additionalProperties":false,"properties":{"append_only":{"type":"boolean"},"entries":{"items":{"additionalProperties":false,"properties":{"audit_id":{"minLength":1,"type":"string"},"disposition":{"minLength":1,"type":"string"},"message":{"minLength":1,"type":"string"},"source_location":{"minLength":1,"type":"string"},"subject":{"minLength":1,"type":"string"}},"required":["audit_id","disposition","subject","message","source_location"],"type":"object"},"minItems":1,"type":"array"},"frozen_expected_status":{"enum":["BOOTSTRAP_BLOCKED","BUDGET_OBSTRUCTION","CERTIFIED_NONINTERACTION","COMMON_REFINEMENT_NONSTRICT","CONTACT_WITHOUT_JOIN","DRIVEN_ARROW","FAKE_JOIN_RELABELING","FAKE_JOIN_SCHEDULING","HOLONOMY_ZERO_ARROW","INDEPENDENCE_GATE_FAILED","LAWFUL_FIRST_EXTENSION","NO_EVIDENCED_CONTACT","OCCURRENT_EVENT","ORDER_RESIDUE","PROSPECTIVE_ADMISSION","REACHABLE_NONOCCURRENT","REFINEMENT_DESTROYS_JOIN","RETENTION_OBSTRUCTION","RETROSPECTIVE_SELF_CERTIFICATION_REJECTED","SOUND_UNREACHABLE","SOURCE_OBSTRUCTION","STRICT_JOIN","UNLICENSED_TOTALITY_TRANSFER","UNPRICED_OBSERVER"],"type":"string"}},"required":["append_only","frozen_expected_status","entries"],"type":"object"},"budget_ledger":{"additionalProperties":false,"properties":{"budget_ok":{"type":"boolean"},"entries":{"items":{"additionalProperties":false,"properties":{"allocated":{"minimum":0,"type":"integer"},"disposition":{"minLength":1,"type":"string"},"kind":{"minLength":1,"type":"string"},"occupied":{"minimum":0,"type":"integer"},"refunded":{"minimum":0,"type":"integer"},"resource_id":{"minLength":1,"type":"string"},"spent":{"minimum":0,"type":"integer"}},"required":["resource_id","kind","allocated","spent","refunded","occupied","disposition"],"type":"object"},"minItems":1,"type":"array"},"observer_priced":{"type":"boolean"}},"required":["budget_ok","observer_priced","entries"],"type":"object"},"contact_surface":{"additionalProperties":false,"properties":{"admissible":{"type":"boolean"},"compatible":{"type":"boolean"},"crossing_relation":{"minLength":1,"type":"string"},"left_interface":{"minimum":0,"type":"integer"},"left_theory":{"minimum":0,"type":"integer"},"right_interface":{"minimum":0,"type":"integer"},"right_theory":{"minimum":0,"type":"integer"},"scope_id":{"minLength":1,"type":"string"},"surface_id":{"minLength":1,"type":"string"}},"required":["surface_id","left_theory","right_theory","left_interface","right_interface","crossing_relation","compatible","admissible","scope_id"],"type":"object"},"contact_witness":{"additionalProperties":false,"properties":{"crossed":{"type":"boolean"},"event_id":{"minLength":1,"type":"string"},"payload_description":{"minLength":1,"type":"string"},"present":{"type":"boolean"},"source_id":{"minLength":1,"type":"string"},"source_typed":{"type":"boolean"},"surface_id":{"minLength":1,"type":"string"},"witness_id":{"minLength":1,"type":"string"}},"required":["witness_id","present","surface_id","event_id","source_id","crossed","source_typed","payload_description"],"type":"object"},"domain_state":{"additionalProperties":false,"properties":{"admissible":{"type":"boolean"},"exposed":{"type":"boolean"},"expressible":{"type":"boolean"},"interface_id":{"minimum":0,"type":"integer"},"occurrent":{"type":"boolean"},"present":{"type":"boolean"},"reachable":{"type":"boolean"},"recoverable":{"type":"boolean"},"scope_id":{"minLength":1,"type":"string"},"theory_id":{"minimum":0,"type":"integer"},"timestamp":{"minimum":0,"type":"integer"}},"required":["theory_id","interface_id","scope_id","timestamp","expressible","present","exposed","recoverable","admissible","reachable","occurrent"],"type":"object"},"enablement_record":{"additionalProperties":false,"properties":{"attribution":{"minLength":1,"type":"string"},"enabled_operation":{"minLength":1,"type":"string"},"enablement_id":{"minLength":1,"type":"string"},"executed":{"type":"boolean"},"source_id":{"minLength":1,"type":"string"},"target_after_timestamp":{"minimum":0,"type":"integer"},"target_before_timestamp":{"minimum":0,"type":"integer"}},"required":["enablement_id","enabled_operation","source_id","executed","target_before_timestamp","target_after_timestamp","attribution"],"type":"object"},"interaction_record":{"additionalProperties":false,"properties":{"contact_witness_present":{"type":"boolean"},"interaction_id":{"minLength":1,"type":"string"},"parents":{"items":{"minimum":0,"type":"integer"},"minItems":1,"type":"array"},"status":{"enum":["BOOTSTRAP_BLOCKED","BUDGET_OBSTRUCTION","CERTIFIED_NONINTERACTION","COMMON_REFINEMENT_NONSTRICT","CONTACT_WITHOUT_JOIN","DRIVEN_ARROW","FAKE_JOIN_RELABELING","FAKE_JOIN_SCHEDULING","HOLONOMY_ZERO_ARROW","INDEPENDENCE_GATE_FAILED","LAWFUL_FIRST_EXTENSION","NO_EVIDENCED_CONTACT","OCCURRENT_EVENT","ORDER_RESIDUE","PROSPECTIVE_ADMISSION","REACHABLE_NONOCCURRENT","REFINEMENT_DESTROYS_JOIN","RETENTION_OBSTRUCTION","RETROSPECTIVE_SELF_CERTIFICATION_REJECTED","SOUND_UNREACHABLE","SOURCE_OBSTRUCTION","STRICT_JOIN","UNLICENSED_TOTALITY_TRANSFER","UNPRICED_OBSERVER"],"type":"string"},"timestamp":{"minimum":0,"type":"integer"},"transition_ids":{"items":{"minLength":1,"type":"string"},"type":"array"}},"required":["interaction_id","parents","contact_witness_present","transition_ids","status","timestamp"],"type":"object"},"join_candidate":{"additionalProperties":false,"properties":{"candidate_id":{"minLength":1,"type":"string"},"common_refinement":{"type":"boolean"},"comparison_baseline":{"minLength":1,"type":"string"},"composite":{"type":"boolean"},"composite_theory":{"minimum":0,"type":"integer"},"present":{"type":"boolean"}},"required":["candidate_id","present","composite_theory","comparison_baseline","composite","common_refinement"],"type":"object"},"join_certificate":{"additionalProperties":false,"properties":{"budget_witnesses":{"items":{"minLength":1,"type":"string"},"type":"array"},"certificate_id":{"minLength":1,"type":"string"},"objecthood_witness":{"type":"boolean"},"present":{"type":"boolean"},"retention_witnesses":{"items":{"minLength":1,"type":"string"},"type":"array"},"source_witnesses":{"items":{"minLength":1,"type":"string"},"type":"array"},"strictness_witness":{"type":"boolean"}},"required":["certificate_id","present","objecthood_witness","retention_witnesses","source_witnesses","budget_witnesses","strictness_witness"],"type":"object"},"join_obstruction":{"additionalProperties":false,"properties":{"escape_routes":{"items":{"minLength":1,"type":"string"},"minItems":1,"type":"array"},"kind":{"minLength":1,"type":"string"},"obstruction_id":{"minLength":1,"type":"string"},"present":{"type":"boolean"},"witness_description":{"minLength":1,"type":"string"}},"required":["obstruction_id","present","kind","witness_description","escape_routes"],"type":"object"},"noninteraction_certificate":{"additionalProperties":false,"properties":{"budget":{"minimum":0,"type":"integer"},"certificate_id":{"minLength":1,"type":"string"},"covered_family":{"minLength":1,"type":"string"},"detector_id":{"minLength":1,"type":"string"},"detector_power":{"type":"boolean"},"escape_routes":{"items":{"minLength":1,"type":"string"},"minItems":1,"type":"array"},"family_closed":{"type":"boolean"},"horizon":{"minimum":0,"type":"integer"},"observed_contact":{"type":"boolean"},"present":{"type":"boolean"}},"required":["certificate_id","present","covered_family","family_closed","detector_id","detector_power","budget","horizon","observed_contact","escape_routes"],"type":"object"},"observer_occupancy_record":{"additionalProperties":false,"properties":{"capacity":{"minimum":0,"type":"integer"},"charged":{"minimum":0,"type":"integer"},"disposition":{"minLength":1,"type":"string"},"observer_id":{"minLength":1,"type":"string"},"occupancy_id":{"minLength":1,"type":"string"},"occupied":{"minimum":0,"type":"integer"},"source_kind":{"minLength":1,"type":"string"},"used":{"type":"boolean"},"visible_interfaces":{"items":{"minimum":0,"type":"integer"},"minItems":1,"type":"array"}},"required":["occupancy_id","observer_id","used","source_kind","visible_interfaces","capacity","occupied","charged","disposition"],"type":"object"},"prospective_commitment":{"additionalProperties":false,"properties":{"active":{"type":"boolean"},"commitment_id":{"minLength":1,"type":"string"},"disposition":{"minLength":1,"type":"string"},"expires_at":{"minimum":0,"type":"integer"},"future_transition":{"minLength":1,"type":"string"},"permitted_source_kinds":{"items":{"minLength":1,"type":"string"},"minItems":1,"type":"array"},"preregistered":{"type":"boolean"},"registered_at":{"minimum":0,"type":"integer"},"reserved_budget":{"minimum":0,"type":"integer"},"source_id":{"minLength":1,"type":"string"},"valid_from":{"minimum":0,"type":"integer"}},"required":["commitment_id","active","registered_at","valid_from","expires_at","future_transition","reserved_budget","source_id","permitted_source_kinds","preregistered","disposition"],"type":"object"},"reachability_witness":{"additionalProperties":false,"properties":{"executable":{"type":"boolean"},"guards_satisfied":{"type":"boolean"},"initial_timestamp":{"minimum":0,"type":"integer"},"present":{"type":"boolean"},"resources_available":{"type":"boolean"},"terminal_timestamp":{"minimum":0,"type":"integer"},"trace_timestamps":{"items":{"minimum":0,"type":"integer"},"type":"array"},"transition_ids":{"items":{"minLength":1,"type":"string"},"type":"array"},"witness_id":{"minLength":1,"type":"string"}},"required":["witness_id","present","initial_timestamp","terminal_timestamp","transition_ids","trace_timestamps","guards_satisfied","resources_available","executable"],"type":"object"},"source_ledger":{"additionalProperties":false,"properties":{"entries":{"items":{"additionalProperties":false,"properties":{"disposition":{"minLength":1,"type":"string"},"generated_by_system":{"type":"boolean"},"in_scope":{"type":"boolean"},"kind":{"minLength":1,"type":"string"},"parent_sources":{"items":{"minLength":1,"type":"string"},"type":"array"},"source_id":{"minLength":1,"type":"string"}},"required":["source_id","kind","parent_sources","generated_by_system","in_scope","disposition"],"type":"object"},"minItems":1,"type":"array"},"generator_reachable":{"type":"boolean"},"neutral_seed":{"type":"boolean"},"observer_used":{"type":"boolean"},"same_source":{"type":"boolean"},"seed":{"type":"boolean"},"source_independent":{"type":"boolean"}},"required":["seed","neutral_seed","generator_reachable","same_source","source_independent","observer_used","entries"],"type":"object"}},"required":["domain_state","admission_transition","prospective_commitment","source_ledger","budget_ledger","contact_surface","contact_witness","interaction_record","join_candidate","join_certificate","join_obstruction","noninteraction_certificate","enablement_record","reachability_witness","observer_occupancy_record","audit_record"],"type":"object"}},"required":["schema_version","fixture_kind","fixture_id","name","expected_status","flags","assertions","candidate_ids","falsifier","structural_record","source_trace"],"title":"Foundations VII Phase-1 scenario fixture","type":"object"}
