{"assertions":{"endogenous":false},"candidate_ids":["VII-C011","VII-C012","VII-C013","VII-C025","VII-C029"],"expected_status":"UNPRICED_OBSERVER","falsifier":"Reference evaluator status or any declared assertion differs from the frozen expectation.","fixture_id":"TTW-S22","fixture_kind":"scenario","flags":{"anti_product":false,"budget_ok":false,"closed_family":false,"common_refinement":false,"compatible":false,"composite":false,"contact":false,"detector_power":false,"drive":false,"fired":true,"generator_reachable":false,"holonomy":false,"join_destroyed":false,"neutral_seed":false,"new_residual":false,"observer_priced":false,"observer_used":true,"order_residue":false,"parent_refined":false,"partial_domain":false,"prospective":false,"reachable":true,"relabel_only":false,"resemblance_only":false,"retention":false,"retrospective":false,"same_source":false,"scheduling_only":false,"seed":false,"sound":false,"source_independent":false,"total_lens_only":false},"name":"Unpriced observer occupancy","schema_version":"FVII-SCI-01.3","source_trace":{"migration":"LOSSLESS_FLAGS_AND_EXPECTATIONS_PLUS_15_OBJECT_TYPED_ENVELOPE","source_id":"TTW-S22","source_path":"readiness/two_theory_world/scenarios.jsonl"},"structural_record":{"admission_transition":{"cost":1,"effect_description":"Advance to the frozen target state","executable":true,"fired":true,"guard_description":"Frozen finite-world guard","guard_satisfied":true,"source":{"admissible":true,"exposed":true,"expressible":true,"interface_id":101,"occurrent":false,"present":true,"reachable":true,"recoverable":true,"scope_id":"TTW-FROZEN-FAMILY","theory_id":1,"timestamp":21},"source_id":"TTW-S22-SOURCE","target":{"admissible":true,"exposed":true,"expressible":true,"interface_id":101,"occurrent":true,"present":true,"reachable":true,"recoverable":true,"scope_id":"TTW-FROZEN-FAMILY","theory_id":1,"timestamp":22},"transition_id":"TTW-S22-TRANSITION"},"audit_record":{"append_only":true,"entries":[{"audit_id":"TTW-S22-FREEZE","disposition":"ACCEPTED","message":"Step-3 expected status frozen before Phase-1 implementation.","source_location":"readiness/two_theory_world/scenarios.jsonl","subject":"TTW-S22"}],"frozen_expected_status":"UNPRICED_OBSERVER"},"budget_ledger":{"budget_ok":false,"entries":[{"allocated":0,"disposition":"FAILED","kind":"OCCUPANCY","occupied":1,"refunded":0,"resource_id":"TTW-S22-RESOURCE","spent":0}],"observer_priced":false},"contact_surface":{"admissible":false,"compatible":false,"crossing_relation":"TTW_DECLARED_CROSSING","left_interface":101,"left_theory":1,"right_interface":201,"right_theory":2,"scope_id":"TTW-FROZEN-FAMILY","surface_id":"TTW-S22-SURFACE"},"contact_witness":{"crossed":false,"event_id":"TTW-S22-EVENT","payload_description":"NO_CONTACT_PAYLOAD","present":false,"source_id":"TTW-S22-SOURCE","source_typed":false,"surface_id":"TTW-S22-SURFACE","witness_id":"TTW-S22-CONTACT"},"domain_state":{"admissible":true,"exposed":true,"expressible":true,"interface_id":101,"occurrent":true,"present":true,"reachable":true,"recoverable":true,"scope_id":"TTW-FROZEN-FAMILY","theory_id":1,"timestamp":22},"enablement_record":{"attribution":"OBSERVER","enabled_operation":"FROZEN_TRANSITION","enablement_id":"TTW-S22-ENABLEMENT","executed":true,"source_id":"TTW-S22-SOURCE","target_after_timestamp":22,"target_before_timestamp":21},"interaction_record":{"contact_witness_present":false,"interaction_id":"TTW-S22-INTERACTION","parents":[1,2],"status":"UNPRICED_OBSERVER","timestamp":22,"transition_ids":["TTW-S22-TRANSITION"]},"join_candidate":{"candidate_id":"TTW-S22-JOIN-CANDIDATE","common_refinement":false,"comparison_baseline":"PARENT_PRODUCT_BASELINE","composite":false,"composite_theory":3,"present":false},"join_certificate":{"budget_witnesses":[],"certificate_id":"TTW-S22-JOIN-CERTIFICATE","objecthood_witness":false,"present":false,"retention_witnesses":[],"source_witnesses":[],"strictness_witness":false},"join_obstruction":{"escape_routes":["Add the missing typed witness or narrow the claim."],"kind":"NONE","obstruction_id":"TTW-S22-OBSTRUCTION","present":false,"witness_description":"NO_DECLARED_OBSTRUCTION"},"noninteraction_certificate":{"budget":1,"certificate_id":"TTW-S22-NONINTERACTION","covered_family":"TTW-FROZEN-FAMILY","detector_id":"FVII-DETECTOR-25","detector_power":false,"escape_routes":["Expand the carrier, horizon, budget, or detector family."],"family_closed":false,"horizon":1,"observed_contact":false,"present":false},"observer_occupancy_record":{"capacity":1,"charged":0,"disposition":"FAILED","observer_id":"TTW-OBSERVER","occupancy_id":"TTW-S22-OBSERVER","occupied":1,"source_kind":"OBSERVER","used":true,"visible_interfaces":[101,201]},"prospective_commitment":{"active":false,"commitment_id":"TTW-S22-COMMITMENT","disposition":"FAILED","expires_at":23,"future_transition":"TTW-S22-TRANSITION","permitted_source_kinds":["OBSERVER"],"preregistered":false,"registered_at":21,"reserved_budget":0,"source_id":"TTW-S22-SOURCE","valid_from":22},"reachability_witness":{"executable":true,"guards_satisfied":true,"initial_timestamp":21,"present":true,"resources_available":true,"terminal_timestamp":22,"trace_timestamps":[21,22],"transition_ids":["TTW-S22-TRANSITION"],"witness_id":"TTW-S22-REACHABILITY"},"source_ledger":{"entries":[{"disposition":"ACCEPTED","generated_by_system":false,"in_scope":true,"kind":"OBSERVER","parent_sources":[],"source_id":"TTW-S22-SOURCE"}],"generator_reachable":false,"neutral_seed":false,"observer_used":true,"same_source":false,"seed":false,"source_independent":false}}}
