{"assertions":{"strict_join":false},"candidate_ids":["VII-C025"],"expected_status":"FAKE_JOIN_SCHEDULING","falsifier":"Reference evaluator status or any declared assertion differs from the frozen expectation.","fixture_id":"TTW-S14","fixture_kind":"scenario","flags":{"anti_product":false,"budget_ok":false,"closed_family":false,"common_refinement":false,"compatible":false,"composite":true,"contact":true,"detector_power":false,"drive":false,"fired":false,"generator_reachable":false,"holonomy":false,"join_destroyed":false,"neutral_seed":false,"new_residual":false,"observer_priced":false,"observer_used":false,"order_residue":false,"parent_refined":false,"partial_domain":false,"prospective":false,"reachable":false,"relabel_only":false,"resemblance_only":false,"retention":false,"retrospective":false,"same_source":false,"scheduling_only":true,"seed":false,"sound":false,"source_independent":false,"total_lens_only":false},"name":"Scheduling artifact masquerades as novelty","schema_version":"FVII-SCI-01.3","source_trace":{"migration":"LOSSLESS_FLAGS_AND_EXPECTATIONS_PLUS_15_OBJECT_TYPED_ENVELOPE","source_id":"TTW-S14","source_path":"readiness/two_theory_world/scenarios.jsonl"},"structural_record":{"admission_transition":{"cost":1,"effect_description":"Advance to the frozen target state","executable":true,"fired":false,"guard_description":"Frozen finite-world guard","guard_satisfied":true,"source":{"admissible":true,"exposed":true,"expressible":true,"interface_id":101,"occurrent":false,"present":true,"reachable":false,"recoverable":true,"scope_id":"TTW-FROZEN-FAMILY","theory_id":1,"timestamp":13},"source_id":"TTW-S14-SOURCE","target":{"admissible":true,"exposed":true,"expressible":true,"interface_id":101,"occurrent":false,"present":true,"reachable":false,"recoverable":true,"scope_id":"TTW-FROZEN-FAMILY","theory_id":1,"timestamp":14},"transition_id":"TTW-S14-TRANSITION"},"audit_record":{"append_only":true,"entries":[{"audit_id":"TTW-S14-FREEZE","disposition":"ACCEPTED","message":"Step-3 expected status frozen before Phase-1 implementation.","source_location":"readiness/two_theory_world/scenarios.jsonl","subject":"TTW-S14"}],"frozen_expected_status":"FAKE_JOIN_SCHEDULING"},"budget_ledger":{"budget_ok":false,"entries":[{"allocated":0,"disposition":"FAILED","kind":"CROSS_COST","occupied":0,"refunded":0,"resource_id":"TTW-S14-RESOURCE","spent":0}],"observer_priced":false},"contact_surface":{"admissible":true,"compatible":false,"crossing_relation":"TTW_DECLARED_CROSSING","left_interface":101,"left_theory":1,"right_interface":201,"right_theory":2,"scope_id":"TTW-FROZEN-FAMILY","surface_id":"TTW-S14-SURFACE"},"contact_witness":{"crossed":true,"event_id":"TTW-S14-EVENT","payload_description":"Frozen contact payload","present":true,"source_id":"TTW-S14-SOURCE","source_typed":true,"surface_id":"TTW-S14-SURFACE","witness_id":"TTW-S14-CONTACT"},"domain_state":{"admissible":true,"exposed":true,"expressible":true,"interface_id":101,"occurrent":false,"present":true,"reachable":false,"recoverable":true,"scope_id":"TTW-FROZEN-FAMILY","theory_id":1,"timestamp":14},"enablement_record":{"attribution":"BRIDGED","enabled_operation":"FROZEN_TRANSITION","enablement_id":"TTW-S14-ENABLEMENT","executed":false,"source_id":"TTW-S14-SOURCE","target_after_timestamp":14,"target_before_timestamp":13},"interaction_record":{"contact_witness_present":true,"interaction_id":"TTW-S14-INTERACTION","parents":[1,2],"status":"FAKE_JOIN_SCHEDULING","timestamp":14,"transition_ids":["TTW-S14-TRANSITION"]},"join_candidate":{"candidate_id":"TTW-S14-JOIN-CANDIDATE","common_refinement":false,"comparison_baseline":"PARENT_PRODUCT_BASELINE","composite":true,"composite_theory":3,"present":true},"join_certificate":{"budget_witnesses":[],"certificate_id":"TTW-S14-JOIN-CERTIFICATE","objecthood_witness":true,"present":false,"retention_witnesses":[],"source_witnesses":[],"strictness_witness":false},"join_obstruction":{"escape_routes":["Add the missing typed witness or narrow the claim."],"kind":"RETENTION","obstruction_id":"TTW-S14-OBSTRUCTION","present":true,"witness_description":"Frozen missing or defeated join obligation"},"noninteraction_certificate":{"budget":1,"certificate_id":"TTW-S14-NONINTERACTION","covered_family":"TTW-FROZEN-FAMILY","detector_id":"FVII-DETECTOR-25","detector_power":false,"escape_routes":["Expand the carrier, horizon, budget, or detector family."],"family_closed":false,"horizon":1,"observed_contact":true,"present":false},"observer_occupancy_record":{"capacity":1,"charged":0,"disposition":"ACCEPTED","observer_id":"TTW-OBSERVER","occupancy_id":"TTW-S14-OBSERVER","occupied":0,"source_kind":"OBSERVER","used":false,"visible_interfaces":[101]},"prospective_commitment":{"active":false,"commitment_id":"TTW-S14-COMMITMENT","disposition":"FAILED","expires_at":15,"future_transition":"TTW-S14-TRANSITION","permitted_source_kinds":["BRIDGED"],"preregistered":false,"registered_at":13,"reserved_budget":0,"source_id":"TTW-S14-SOURCE","valid_from":14},"reachability_witness":{"executable":false,"guards_satisfied":false,"initial_timestamp":13,"present":false,"resources_available":false,"terminal_timestamp":14,"trace_timestamps":[],"transition_ids":[],"witness_id":"TTW-S14-REACHABILITY"},"source_ledger":{"entries":[{"disposition":"ACCEPTED","generated_by_system":false,"in_scope":true,"kind":"BRIDGED","parent_sources":[],"source_id":"TTW-S14-SOURCE"}],"generator_reachable":false,"neutral_seed":false,"observer_used":false,"same_source":false,"seed":false,"source_independent":false}}}
