{"assertions":{"first_extension":false},"candidate_ids":["VII-C003","VII-C025","VII-C035"],"expected_status":"BOOTSTRAP_BLOCKED","falsifier":"Reference evaluator status or any declared assertion differs from the frozen expectation.","fixture_id":"TTW-S01","fixture_kind":"scenario","flags":{"anti_product":false,"budget_ok":false,"closed_family":false,"common_refinement":false,"compatible":false,"composite":false,"contact":false,"detector_power":false,"drive":false,"fired":false,"generator_reachable":false,"holonomy":false,"join_destroyed":false,"neutral_seed":false,"new_residual":false,"observer_priced":false,"observer_used":false,"order_residue":false,"parent_refined":false,"partial_domain":false,"prospective":false,"reachable":false,"relabel_only":false,"resemblance_only":false,"retention":false,"retrospective":false,"same_source":false,"scheduling_only":false,"seed":false,"sound":false,"source_independent":false,"total_lens_only":false},"name":"Closed bootstrap with no seed","schema_version":"FVII-SCI-01.3","source_trace":{"migration":"LOSSLESS_FLAGS_AND_EXPECTATIONS_PLUS_15_OBJECT_TYPED_ENVELOPE","source_id":"TTW-S01","source_path":"readiness/two_theory_world/scenarios.jsonl"},"structural_record":{"admission_transition":{"cost":0,"effect_description":"Advance to the frozen target state","executable":false,"fired":false,"guard_description":"Frozen finite-world guard","guard_satisfied":false,"source":{"admissible":false,"exposed":false,"expressible":true,"interface_id":101,"occurrent":false,"present":false,"reachable":false,"recoverable":false,"scope_id":"TTW-FROZEN-FAMILY","theory_id":1,"timestamp":0},"source_id":"TTW-S01-SOURCE","target":{"admissible":false,"exposed":false,"expressible":true,"interface_id":101,"occurrent":false,"present":false,"reachable":false,"recoverable":false,"scope_id":"TTW-FROZEN-FAMILY","theory_id":1,"timestamp":1},"transition_id":"TTW-S01-TRANSITION"},"audit_record":{"append_only":true,"entries":[{"audit_id":"TTW-S01-FREEZE","disposition":"ACCEPTED","message":"Step-3 expected status frozen before Phase-1 implementation.","source_location":"readiness/two_theory_world/scenarios.jsonl","subject":"TTW-S01"}],"frozen_expected_status":"BOOTSTRAP_BLOCKED"},"budget_ledger":{"budget_ok":false,"entries":[{"allocated":0,"disposition":"ACCEPTED","kind":"CROSS_COST","occupied":0,"refunded":0,"resource_id":"TTW-S01-RESOURCE","spent":0}],"observer_priced":false},"contact_surface":{"admissible":false,"compatible":false,"crossing_relation":"TTW_DECLARED_CROSSING","left_interface":101,"left_theory":1,"right_interface":201,"right_theory":2,"scope_id":"TTW-FROZEN-FAMILY","surface_id":"TTW-S01-SURFACE"},"contact_witness":{"crossed":false,"event_id":"TTW-S01-EVENT","payload_description":"NO_CONTACT_PAYLOAD","present":false,"source_id":"TTW-S01-SOURCE","source_typed":false,"surface_id":"TTW-S01-SURFACE","witness_id":"TTW-S01-CONTACT"},"domain_state":{"admissible":false,"exposed":false,"expressible":true,"interface_id":101,"occurrent":false,"present":false,"reachable":false,"recoverable":false,"scope_id":"TTW-FROZEN-FAMILY","theory_id":1,"timestamp":1},"enablement_record":{"attribution":"NATIVE","enabled_operation":"FROZEN_TRANSITION","enablement_id":"TTW-S01-ENABLEMENT","executed":false,"source_id":"TTW-S01-SOURCE","target_after_timestamp":1,"target_before_timestamp":0},"interaction_record":{"contact_witness_present":false,"interaction_id":"TTW-S01-INTERACTION","parents":[1,2],"status":"BOOTSTRAP_BLOCKED","timestamp":1,"transition_ids":["TTW-S01-TRANSITION"]},"join_candidate":{"candidate_id":"TTW-S01-JOIN-CANDIDATE","common_refinement":false,"comparison_baseline":"PARENT_PRODUCT_BASELINE","composite":false,"composite_theory":3,"present":false},"join_certificate":{"budget_witnesses":[],"certificate_id":"TTW-S01-JOIN-CERTIFICATE","objecthood_witness":false,"present":false,"retention_witnesses":[],"source_witnesses":[],"strictness_witness":false},"join_obstruction":{"escape_routes":["Add the missing typed witness or narrow the claim."],"kind":"NONE","obstruction_id":"TTW-S01-OBSTRUCTION","present":false,"witness_description":"NO_DECLARED_OBSTRUCTION"},"noninteraction_certificate":{"budget":1,"certificate_id":"TTW-S01-NONINTERACTION","covered_family":"TTW-FROZEN-FAMILY","detector_id":"FVII-DETECTOR-25","detector_power":false,"escape_routes":["Expand the carrier, horizon, budget, or detector family."],"family_closed":false,"horizon":1,"observed_contact":false,"present":false},"observer_occupancy_record":{"capacity":1,"charged":0,"disposition":"ACCEPTED","observer_id":"TTW-OBSERVER","occupancy_id":"TTW-S01-OBSERVER","occupied":0,"source_kind":"OBSERVER","used":false,"visible_interfaces":[101]},"prospective_commitment":{"active":false,"commitment_id":"TTW-S01-COMMITMENT","disposition":"FAILED","expires_at":2,"future_transition":"TTW-S01-TRANSITION","permitted_source_kinds":["NATIVE"],"preregistered":false,"registered_at":0,"reserved_budget":0,"source_id":"TTW-S01-SOURCE","valid_from":1},"reachability_witness":{"executable":false,"guards_satisfied":false,"initial_timestamp":0,"present":false,"resources_available":true,"terminal_timestamp":1,"trace_timestamps":[],"transition_ids":[],"witness_id":"TTW-S01-REACHABILITY"},"source_ledger":{"entries":[{"disposition":"ACCEPTED","generated_by_system":false,"in_scope":true,"kind":"NATIVE","parent_sources":[],"source_id":"TTW-S01-SOURCE"}],"generator_reachable":false,"neutral_seed":false,"observer_used":false,"same_source":false,"seed":false,"source_independent":false}}}
