{"assertions":{"endogenous":false,"first_extension":true},"candidate_ids":["VII-C003","VII-C004","VII-C012","VII-C013","VII-C025"],"expected_status":"LAWFUL_FIRST_EXTENSION","falsifier":"Reference evaluator status or any declared assertion differs from the frozen expectation.","fixture_id":"TTW-S02","fixture_kind":"scenario","flags":{"anti_product":false,"budget_ok":false,"closed_family":false,"common_refinement":false,"compatible":false,"composite":false,"contact":false,"detector_power":false,"drive":false,"fired":true,"generator_reachable":true,"holonomy":false,"join_destroyed":false,"neutral_seed":true,"new_residual":false,"observer_priced":false,"observer_used":false,"order_residue":false,"parent_refined":false,"partial_domain":false,"prospective":false,"reachable":true,"relabel_only":false,"resemblance_only":false,"retention":false,"retrospective":false,"same_source":false,"scheduling_only":false,"seed":true,"sound":false,"source_independent":false,"total_lens_only":false},"name":"External neutral seed enables first extension","schema_version":"FVII-SCI-01.3","source_trace":{"migration":"LOSSLESS_FLAGS_AND_EXPECTATIONS_PLUS_15_OBJECT_TYPED_ENVELOPE","source_id":"TTW-S02","source_path":"readiness/two_theory_world/scenarios.jsonl"},"structural_record":{"admission_transition":{"cost":1,"effect_description":"Advance to the frozen target state","executable":true,"fired":true,"guard_description":"Frozen finite-world guard","guard_satisfied":true,"source":{"admissible":true,"exposed":true,"expressible":true,"interface_id":101,"occurrent":false,"present":true,"reachable":true,"recoverable":true,"scope_id":"TTW-FROZEN-FAMILY","theory_id":1,"timestamp":1},"source_id":"TTW-S02-SOURCE","target":{"admissible":true,"exposed":true,"expressible":true,"interface_id":101,"occurrent":true,"present":true,"reachable":true,"recoverable":true,"scope_id":"TTW-FROZEN-FAMILY","theory_id":1,"timestamp":2},"transition_id":"TTW-S02-TRANSITION"},"audit_record":{"append_only":true,"entries":[{"audit_id":"TTW-S02-FREEZE","disposition":"ACCEPTED","message":"Step-3 expected status frozen before Phase-1 implementation.","source_location":"readiness/two_theory_world/scenarios.jsonl","subject":"TTW-S02"}],"frozen_expected_status":"LAWFUL_FIRST_EXTENSION"},"budget_ledger":{"budget_ok":false,"entries":[{"allocated":0,"disposition":"ACCEPTED","kind":"CROSS_COST","occupied":0,"refunded":0,"resource_id":"TTW-S02-RESOURCE","spent":0}],"observer_priced":false},"contact_surface":{"admissible":false,"compatible":false,"crossing_relation":"TTW_DECLARED_CROSSING","left_interface":101,"left_theory":1,"right_interface":201,"right_theory":2,"scope_id":"TTW-FROZEN-FAMILY","surface_id":"TTW-S02-SURFACE"},"contact_witness":{"crossed":false,"event_id":"TTW-S02-EVENT","payload_description":"NO_CONTACT_PAYLOAD","present":false,"source_id":"TTW-S02-SOURCE","source_typed":false,"surface_id":"TTW-S02-SURFACE","witness_id":"TTW-S02-CONTACT"},"domain_state":{"admissible":true,"exposed":true,"expressible":true,"interface_id":101,"occurrent":true,"present":true,"reachable":true,"recoverable":true,"scope_id":"TTW-FROZEN-FAMILY","theory_id":1,"timestamp":2},"enablement_record":{"attribution":"EXTERNAL_PROVISION","enabled_operation":"FROZEN_TRANSITION","enablement_id":"TTW-S02-ENABLEMENT","executed":true,"source_id":"TTW-S02-SOURCE","target_after_timestamp":2,"target_before_timestamp":1},"interaction_record":{"contact_witness_present":false,"interaction_id":"TTW-S02-INTERACTION","parents":[1,2],"status":"LAWFUL_FIRST_EXTENSION","timestamp":2,"transition_ids":["TTW-S02-TRANSITION"]},"join_candidate":{"candidate_id":"TTW-S02-JOIN-CANDIDATE","common_refinement":false,"comparison_baseline":"PARENT_PRODUCT_BASELINE","composite":false,"composite_theory":3,"present":false},"join_certificate":{"budget_witnesses":[],"certificate_id":"TTW-S02-JOIN-CERTIFICATE","objecthood_witness":false,"present":false,"retention_witnesses":[],"source_witnesses":[],"strictness_witness":false},"join_obstruction":{"escape_routes":["Add the missing typed witness or narrow the claim."],"kind":"NONE","obstruction_id":"TTW-S02-OBSTRUCTION","present":false,"witness_description":"NO_DECLARED_OBSTRUCTION"},"noninteraction_certificate":{"budget":1,"certificate_id":"TTW-S02-NONINTERACTION","covered_family":"TTW-FROZEN-FAMILY","detector_id":"FVII-DETECTOR-25","detector_power":false,"escape_routes":["Expand the carrier, horizon, budget, or detector family."],"family_closed":false,"horizon":1,"observed_contact":false,"present":false},"observer_occupancy_record":{"capacity":1,"charged":0,"disposition":"ACCEPTED","observer_id":"TTW-OBSERVER","occupancy_id":"TTW-S02-OBSERVER","occupied":0,"source_kind":"OBSERVER","used":false,"visible_interfaces":[101]},"prospective_commitment":{"active":false,"commitment_id":"TTW-S02-COMMITMENT","disposition":"FAILED","expires_at":3,"future_transition":"TTW-S02-TRANSITION","permitted_source_kinds":["EXTERNAL_PROVISION"],"preregistered":false,"registered_at":1,"reserved_budget":0,"source_id":"TTW-S02-SOURCE","valid_from":2},"reachability_witness":{"executable":true,"guards_satisfied":true,"initial_timestamp":1,"present":true,"resources_available":true,"terminal_timestamp":2,"trace_timestamps":[1,2],"transition_ids":["TTW-S02-TRANSITION"],"witness_id":"TTW-S02-REACHABILITY"},"source_ledger":{"entries":[{"disposition":"ACCEPTED","generated_by_system":false,"in_scope":true,"kind":"EXTERNAL_PROVISION","parent_sources":[],"source_id":"TTW-S02-SOURCE"}],"generator_reachable":true,"neutral_seed":true,"observer_used":false,"same_source":false,"seed":true,"source_independent":false}}}
